{
  "drawingSpecVersion": "1.0",
  "units": "mm",
  "metadata": {
    "title": "100x60 rectangular plate with one hole",
    "domain": "mechanical_plate",
    "createdBy": "gpt",
    "requestId": "sample-rectangular-plate-001"
  },
  "layers": [
    {
      "name": "OUTLINE",
      "color": 7,
      "lineType": "Continuous",
      "lineWeight": 0.35
    },
    {
      "name": "CENTER",
      "color": 1,
      "lineType": "Center",
      "lineWeight": 0.18
    },
    {
      "name": "DIM",
      "color": 3,
      "lineType": "Continuous",
      "lineWeight": 0.18
    }
  ],
  "entities": [
    {
      "id": "outer-profile",
      "type": "polyline",
      "layer": "OUTLINE",
      "closed": true,
      "points": [[0, 0], [100, 0], [100, 60], [0, 60]]
    },
    {
      "id": "hole-1",
      "type": "circle",
      "layer": "OUTLINE",
      "center": [30, 30],
      "radius": 6
    },
    {
      "id": "hole-1-center",
      "type": "centerMark",
      "layer": "CENTER",
      "center": [30, 30],
      "size": 10
    }
  ],
  "dimensions": [
    {
      "id": "dim-width",
      "type": "linear",
      "layer": "DIM",
      "from": [0, 0],
      "to": [100, 0],
      "offset": [0, -12],
      "text": "100"
    },
    {
      "id": "dim-height",
      "type": "linear",
      "layer": "DIM",
      "from": [100, 0],
      "to": [100, 60],
      "offset": [12, 0],
      "text": "60"
    },
    {
      "id": "dim-hole-dia",
      "type": "diameter",
      "layer": "DIM",
      "targetEntityId": "hole-1",
      "text": "%%c12"
    }
  ],
  "clarifications": []
}

