{
  "drawingSpecVersion": "1.0",
  "units": "mm",
  "metadata": {
    "title": "80x50 rectangular plate with centered single hole",
    "domain": "mechanical_plate",
    "createdBy": "p2-protocol-sample",
    "requestId": "sample-rectangular-plate-single-hole-001"
  },
  "layers": [
    {
      "name": "OUTLINE",
      "color": 7,
      "lineType": "Continuous",
      "lineWeight": 0.35
    },
    {
      "name": "CENTER",
      "color": 1,
      "lineType": "Center",
      "lineWeight": 0.18
    },
    {
      "name": "DIM",
      "color": 3,
      "lineType": "Continuous",
      "lineWeight": 0.18
    }
  ],
  "entities": [
    {
      "id": "outer-profile",
      "type": "polyline",
      "layer": "OUTLINE",
      "closed": true,
      "points": [[0, 0], [80, 0], [80, 50], [0, 50]]
    },
    {
      "id": "center-hole",
      "type": "circle",
      "layer": "OUTLINE",
      "center": [40, 25],
      "radius": 5
    },
    {
      "id": "center-hole-mark",
      "type": "centerMark",
      "layer": "CENTER",
      "center": [40, 25],
      "size": 10
    }
  ],
  "dimensions": [
    {
      "id": "dim-width",
      "type": "linear",
      "layer": "DIM",
      "from": [0, 0],
      "to": [80, 0],
      "offset": [0, -10],
      "text": "80"
    },
    {
      "id": "dim-height",
      "type": "linear",
      "layer": "DIM",
      "from": [80, 0],
      "to": [80, 50],
      "offset": [10, 0],
      "text": "50"
    },
    {
      "id": "dim-hole-dia",
      "type": "diameter",
      "layer": "DIM",
      "targetEntityId": "center-hole",
      "text": "%%c10"
    }
  ],
  "clarifications": []
}
